content_of_the_post,content_media,date,post_url,number_of_likes,number_of_comments
"This list got me thinking about the meaning of these objectives for me. ⁠⁠An 𝗲𝗻𝘁𝗿𝗲𝗽𝗿𝗲𝗻𝗲𝘂𝗿'𝘀 𝗺𝗶𝗻𝗱 means taking charge and being responsible for everything that goes down. ⁠⁠It means being open to different perspectives and possibilities, rather than just saying no. ⁠⁠It means prioritizing action over planning and always looking to learn more. ⁠⁠An 𝗮𝘁𝗵𝗹𝗲𝘁𝗲'𝘀 𝗯𝗼𝗱𝘆 means eating healthy and working out daily. ⁠⁠It means going to bed early and getting a solid 8 hours of sleep. ⁠⁠It means taking time to relax and clear your mind through stretching and meditation, and even trying out fasting and cold exposure. ⁠⁠An 𝗮𝗿𝘁𝗶𝘀𝘁'𝘀 𝘀𝗼𝘂𝗹 means being open to new experiences and finding ways to tap into your creativity. ⁠⁠It means trusting your gut, even if you can't put it into words. ⁠⁠It means being authentic.⁠👉 What do they mean to you?⁠🧩",https://media.licdn.com/dms/image/D5610AQGFrfnxcG8duA/image-shrink_800/0/1683548404417?e=1684720800&v=beta&t=bZAUr5PBW_ftUPH6J6o0yoLMEV1vj2JitfbSE-31SB4,May-2023,https://www.linkedin.com/feed/update/urn:li:activity:7061313832127791104,20,18
I had a great chat with Maurizio a few weeks ago. Here's a short video about a different angle to networking that made it click for me.🧩,,May-2023,https://www.linkedin.com/feed/update/urn:li:activity:7059498137979142144,8,0
"Have you ever heard of the fresh start effect? It's when we're more likely to take action toward a goal after a special event or date has passed. Examples include New Year's Day, the first day of the month, or even a Monday. These can act as mental triggers for us to start something new. 👉 I learned about a strategy to create even more chances for fresh starts - dividing the day into smaller segments like 𝗺𝗼𝗿𝗻𝗶𝗻𝗴, 𝗮𝗳𝘁𝗲𝗿𝗻𝗼𝗼𝗻, 𝗮𝗻𝗱 𝗲𝘃𝗲𝗻𝗶𝗻𝗴. This way, if you miss an opportunity to do something, you can try again in a few hours. For example, if you have a tough morning, don't let it ruin the whole day - you can start fresh in the afternoon.🧩",https://media.licdn.com/dms/image/D5610AQEnvQac7HBoNg/image-shrink_800/0/1682943603221?e=1684720800&v=beta&t=ef936PfdtaO-WXizENwut7Zdrn_HhxvAklR-6x9CRzA,May-2023,https://www.linkedin.com/feed/update/urn:li:activity:7058777132696571904,23,4
"L’amore non ha confini, puó solo moltiplicarsi",,May-2023,https://www.linkedin.com/feed/update/urn:li:activity:7057820507366191105,0,0
My greatest hits,https://media.licdn.com/dms/image/D5610AQGkykA9cHZAlw/image-shrink_800/0/1680351602409?e=1684720800&v=beta&t=eMCLTTRZ6dCcWwEHiFtbAGMw8wpD8cna8CO3YB877eQ,April-2023,https://www.linkedin.com/feed/update/urn:li:activity:7047905476109373440,17,2
"Congrats TELUS!𝗥𝗲𝗮𝗱𝗲𝗿𝘀' 𝗖𝗵𝗼𝗶𝗰𝗲 𝟮𝟬𝟮𝟯• Major Carrier: Among the [...] carriers that provide nationwide coverage, Telus comes out on top and earns a Readers' Choice Award• MVNO Carrier: Public Mobile blows away the competition on most of our satisfaction measures, earning the Telus subsidiary a Readers' Choice Award𝗕𝘂𝘀𝗶𝗻𝗲𝘀𝘀 𝗖𝗵𝗼𝗶𝗰𝗲 𝟮𝟬𝟮𝟯• Business Carrier: Public Mobile is an MVNO owned by Telus and uses the Telus Mobility network. It offers low fees and high reliability, which propel it to the top of the list of carriers Canadians prefer for work",,April-2023,https://www.linkedin.com/feed/update/urn:li:activity:7047635988906446848,6,0
"Hi Linkedin,🎙️ We're back with the second and last part of the Careers in the Cloud podcast, in which we discuss recent layoffs at tech companies and my firsthand experiences with this challenging aspect of running a business.📢 I also share some communication strategies for staying connected with your team during challenging times and recommend resources to help managers succeed.📚  We then explore the nuances of managing different generations in the workplace, the keys to successful hiring, and reflect on the 'hire fast, fire faster' approach, considering its implications for your team.💡 Lastly, we discuss self-determination theory and how it might shape your management style.👉 Follow the link in the comments to watch the concluding part of the interview. As always, I hope you find it both enjoyable and insightful.🧩Click [+ Follow] for more",https://media.licdn.com/dms/image/D5610AQFjFdIPYYZh9Q/image-shrink_800/0/1680178801493?e=1684720800&v=beta&t=WPC1c4NG-tqOVbikd9sPgRRXYjzSXgWMMXiCRSNKfCo,April-2023,https://www.linkedin.com/feed/update/urn:li:activity:7047180717667074049,45,7
"Buongiorno Linkedin!🎙️ Come join me for Episode 24 of Careers in the Cloud, where I have the pleasure of discussing my professional journey from Italy to Canada and sharing insights from my work experiences.🌍 We discuss how the industry can influence career longevity and examine the distinctions between a lifestyle business and an impact business. Understanding these differences can be valuable when charting your professional course.💡 I also share the spark that inspired me to create free management content, which led me to start posting on LinkedIn every day for a whole year about 18 months ago.🤝 Finally we dive into the importance of networking and emphasize the need to find a networking approach that resonates with you.👉 Click the link in the comments to watch the interview. I hope you find it both enjoyable and informative.🧩Click [+ Follow] for more",https://media.licdn.com/dms/image/D5610AQE21c2r3QJ2Xg/image-shrink_800/0/1680092400849?e=1684720800&v=beta&t=yuhdAJ05xkuoPhFLTUqXD2oxJfMF3oW_gnus6QRFczM,April-2023,https://www.linkedin.com/feed/update/urn:li:activity:7046818318904676352,35,1
"Hey Linkedin, I recently had the pleasure of joining Maurizio Gioffrè on his excellent podcast, Careers in the Cloud, for a great conversation about Business and Life. We covered everything from the challenges of immigrating to Canada, to the thrill of leaving a small business behind for the big leagues of a large corporation and even delved into self-determination theory. You won't want to miss this chat, so stay tuned.🧩",https://media.licdn.com/dms/image/D5622AQE0nytJpueuFw/feedshare-shrink_800/0/1680006983019?e=1686787200&v=beta&t=6JzHqxmDfC02idiXmbS0BnDRSH_PZzsapNJYnW9Ycls,April-2023,https://www.linkedin.com/feed/update/urn:li:activity:7046460011392225281,68,3
"Enter the Rotary Cellphone by Justine Haupt.This retro-inspired device ditches touchscreens, menus, and apps. The “innovative” design fits in your pocket while still enabling users to make calls with ease.Unless the number you are calling has too many Zeroes and 9s 😜🧩",https://media.licdn.com/dms/image/D5610AQHoFg2d_hhmDw/image-shrink_800/0/1679843104142?e=1684720800&v=beta&t=5y8tmFx13vhgK8tzCh-UNI0f0B2jFmYSgfzvK1ig-Pw,April-2023,https://www.linkedin.com/feed/update/urn:li:activity:7045772691668144128,31,17
"𝗔𝗿𝗲 𝘆𝗼𝘂 𝗚𝗿𝗼𝘄𝗶𝗻𝗴 𝗼𝗿 𝗧𝗵𝗿𝗶𝘃𝗶𝗻𝗴?When it comes to growth and thriving, both involve progress and the development of new abilities. A growing plant is getting larger and developing new leaves and branches, whereas a thriving plant is not only growing but is also healthy and producing fruit. The same is true for people: a growing person is developing new skills and experiences, while a thriving person is not only developing new skills but is also happy and successful.",,April-2023,https://www.linkedin.com/feed/update/urn:li:activity:7045217853867794432,17,1
"Happy Spring Linkedin!Yesterday was the equinox, a special time of year when the day and night are of equal length. This is because the sun is directly above the Earth's equator, rather than north or south of it. Fun fact of the day: the word equinox comes from the Latin aequinoctium, which means equal night (aequus noctis). It occurs twice a year, around March 20th and September 23rd.🧩",https://media.licdn.com/dms/image/C5610AQEdo70WUxBNAg/image-shrink_800/0/1679400906953?e=1684720800&v=beta&t=xbUsyyTuFKbFoxDT_e8I-xvM73CqLTGKRDl1p9Z5bgk,April-2023,https://www.linkedin.com/feed/update/urn:li:activity:7043917970418388992,18,0
"I learned that Payscale conducts a yearly study on the Gender Pay Gap, and below are the 2023 results 👇Like everyone else, I’ve heard about the gender pay gap many times in the media.I always assumed those figures referred to the “controlled” data (i.e. equal pay for equal work). It turns out they were the “uncontrolled” data (i.e. average pay of all men vs of all women). Glad to see we are further ahead than I thought. Now let’s close that last 1%.🧩",https://media.licdn.com/dms/image/C5610AQFOha2LiriokA/image-shrink_800/0/1679314506839?e=1684720800&v=beta&t=DGOdc5zVPJG740PhMm35EKoDODOtgaqLO30vJ7r6FJ8,April-2023,https://www.linkedin.com/feed/update/urn:li:activity:7043555592551989248,12,5
"Spotted in downtown Toronto, this somewhat dystopian AI-powered machine. If you show your item to the camera, it will recognize it and tell you which recycling bin to use. 🧩",https://media.licdn.com/dms/image/C5622AQHlae1qj-cMaA/feedshare-shrink_800/0/1679148351601?e=1686787200&v=beta&t=uOHIS-5gU6C2Q-v6L29g1dL9mZQKiS3bWg3X94Tuq7Y,March-2023,https://www.linkedin.com/feed/update/urn:li:activity:7042858651417542657,27,7
"OpenAI's 𝗚𝗣𝗧-𝟯, or Generative Pre-trained Transformer 3, has caught the world's attention for its ability to produce text closely resembling human speech. 👉 Their next iteration in the GPT series, 𝗚𝗣𝗧-𝟰 is launching next week!GPT-4 is estimated to have been trained with over 100 trillion parameters, which is significantly more than GPT-3's 175 billion parameters. 🤯 These numbers take time to comprehend. If we convert them into time units:• 175 billion seconds is about 5,500 years. That's about the number years elapsed from the construction of the Pyramids to today • 100 trillion seconds is 3,170,979 years or about 𝟲𝟯𝟬 𝘁𝗶𝗺𝗲𝘀 the years elapsed from the construction of the Pyramids 🧩",https://media.licdn.com/dms/image/C5622AQEz8WKkYbYkLA/feedshare-shrink_800/0/1678568072363?e=1686787200&v=beta&t=4YiO7SCtZykZdTzTyvtWKJBri9q4xw1A9r9P_vJe8Mg,March-2023,https://www.linkedin.com/feed/update/urn:li:activity:7040424786514087936,13,2
"I was listening to a serial entrepreneur who said he stopped labelling things as Good or Bad because if he fails, it means he is about to learn something new.• Failure leads to Learning.• Learning leads to Success.• Success leads to Complacency.• Complacency leads to Failure.The cycle is inevitable. His message: Recognize where you are and try to overcome Complacency as quickly as possible.🧩#EntrepreneurshipClick [+ Follow] for more",https://media.licdn.com/dms/image/C5622AQFdbFJ0vvfxeg/feedshare-shrink_800/0/1674825604067?e=1686787200&v=beta&t=r7tD-p4563PEUbCwq6a_qkLEATfIJGfa_yrEyU4UjJA,February-2023,https://www.linkedin.com/feed/update/urn:li:activity:7024727764050079744,21,5
"Companies must have a strong and talented workforce to thrive (and survive) in today's highly competitive business landscape. While certain unicorn organizations may have unique capabilities that set them apart, the vast majority 𝗵𝗮𝘃𝗲 𝗮𝗰𝗰𝗲𝘀𝘀 𝘁𝗼 𝘁𝗵𝗲 𝘀𝗮𝗺𝗲 tools, technologies, best practices, consulting firms, strategies, markets, research, and datasets.Therefore, companies (and managers) need to excel in talent acquisition and retention to succeed and stay ahead of the competition. 🧩#HiringClick [+ Follow] for more",https://media.licdn.com/dms/image/C5622AQEGKxU34qbzdA/feedshare-shrink_800/0/1674652808380?e=1686787200&v=beta&t=hvkZGwogRZrF30683-NoQ3oaci-lUUTErBUoiTRSk8c,February-2023,https://www.linkedin.com/feed/update/urn:li:activity:7024003006404722688,17,2
"How to level up your hiring game 👇Increase your success rate by:• Brushing up on psychology• Taking every chance you get to bring on new talent• Finding ingenious ways to automate the background tasks• Being clear about what kind of team member you need for each roleThen, fine-tune your technique by regularly putting yourself in a decision-making situation and seeking constructive criticism from reliable sources. Revamp your process from time to time with fresh experiments, get the data to back you up, and repeat the cycle.🧩#HiringClick [+ Follow] for more",https://media.licdn.com/dms/image/C5622AQHU3D0MBFa9WQ/feedshare-shrink_800/0/1674566409063?e=1686787200&v=beta&t=CmVbDxgqtv58vldtef93B6dXryTBUBMAmBntRWrNgDA,February-2023,https://www.linkedin.com/feed/update/urn:li:activity:7023640630048284672,6,2
"Are you ready to find the perfect fit for your team or organization? Then let's dive into how we assess candidates.At the core of our evaluation process are three key components: the Head, the Heart, and the Briefcase. 🧠 The 𝗛𝗲𝗮𝗱 represents a person's natural thought processes and decision-making style (aka their drivers). ❤️ The 𝗛𝗲𝗮𝗿𝘁 represents their values and alignment with the culture and vision of the team or organization. 💼 The 𝗕𝗿𝗶𝗲𝗳𝗰𝗮𝘀𝗲 represents their knowledge and experience, including the technical skills and relevant expertise needed for the role.The 𝗸𝗲𝘆 𝘁𝗼 𝘀𝘂𝗰𝗰𝗲𝘀𝘀𝗳𝘂𝗹 𝗵𝗶𝗿𝗶𝗻𝗴 is finding a candidate who excels in all three areas. And to help us do that, we use a variety of tools and techniques to assess each aspect.🧠 𝗙𝗼𝗿 𝘁𝗵𝗲 𝗛𝗲𝗮𝗱 (𝘁𝗵𝗲 𝗗𝗿𝗶𝘃𝗲𝗿𝘀), we rely on a behavioural survey and a 1:1 phone screen to get a sense of how a candidate's brain naturally responds to the world.❤️ 𝗙𝗼𝗿 𝘁𝗵𝗲 𝗛𝗲𝗮𝗿𝘁 (𝘁𝗵𝗲 𝗩𝗮𝗹𝘂𝗲𝘀), we use the phone screen and panel interview to gauge a candidate's alignment with our team's culture and vision.💼 𝗔𝗻𝗱 𝗳𝗼𝗿 𝘁𝗵𝗲 𝗕𝗿𝗶𝗲𝗳𝗰𝗮𝘀𝗲 (𝘁𝗵𝗲 𝗦𝗸𝗶𝗹𝗹𝘀), we turn to the panel interview and past samples of relevant work to assess a candidate's technical skills and expertise.It's important to note that none of these tools is perfect, and they should be considered holistically as part of the evaluation process. By looking at all the data points together, we can hopefully get a 𝗰𝗼𝗻𝘀𝗶𝘀𝘁𝗲𝗻𝘁 𝗽𝗶𝗰𝘁𝘂𝗿𝗲 of the candidate and determine if they are the right fit for the role.To learn more, get the 𝗳𝗿𝗲𝗲 Hiring Manager's Playbook here: 👉 http://bit.ly/3WI1xMc𝗮𝗻𝗱 𝗮𝗽𝗽𝗹𝘆 𝗰𝗼𝗱𝗲  Linkedin100  𝗮𝘁 𝗰𝗵𝗲𝗰𝗸𝗼𝘂𝘁 𝗳𝗼𝗿 𝗮 𝟭𝟬𝟬% 𝗱𝗶𝘀𝗰𝗼𝘂𝗻𝘁.🧩#HiringClick [+ Follow] for more",https://media.licdn.com/dms/image/C5622AQHpsOfBf5CIWA/feedshare-shrink_800/0/1674480005639?e=1686787200&v=beta&t=zNAT9VRBGnBbGf5WJt1LdT18jNLjQ01aYezyjwRe6TU,February-2023,https://www.linkedin.com/feed/update/urn:li:activity:7023278224495308802,25,3
I’ve started to follow more art and architecture accounts to include some “beauty” in my social media diet. This picture appeared in my feed recently and stopped me in my tracks. These are the four main structures in Piazza del Duomo (Cathedral Square) in Florence 🇮🇹1️⃣ The Cathedral of Santa Maria del Fiore2️⃣ The Baptistery of St. John3️⃣ The Brunelleschi's Dome4️⃣ The (Giotto’s) Bell TowerThe Cathedral was built over ~140 years (1296 to approx 1436) 🤯I thought I’d share a little bit of beauty with my LinkedIn friends too. Happy Sunday!🧩,https://media.licdn.com/dms/image/C5622AQEuG3MlYyxXkg/feedshare-shrink_800/0/1674393607816?e=1686787200&v=beta&t=gqyd37cBx0VjbpcVLi9N1lbL1hUEem4JDhBlL-azr2U,January-2023,https://www.linkedin.com/feed/update/urn:li:activity:7022915840790450176,38,5
"I like this quote.It captures the idea that true authenticity and fulfillment can be found when we approach our work with a balance of intensity and playfulness, much like a child.It reminds me of some of my most cherished professional memories. These were projects that were all-consuming but also incredibly fulfilling. Despite the long hours, they didn't feel like work. They felt like serious play with friends instead.These projects had a unique blend of hard work and laughter, constant collaboration and individual contribution, and a balance of carefully crafted master plans and unexpected emerging strategies. We focused on achieving serious business outcomes yet remained playful and lighthearted.Cheers to those projects (and friends), and to many more!🧩#QuotesClick [+ Follow] for more",https://media.licdn.com/dms/image/C5622AQHi8HGcrborIQ/feedshare-shrink_800/0/1674307206081?e=1686787200&v=beta&t=V4OKy1FmFFk7_MEkL4ChrUr9EyfXZXSJ0rm81PADwGk,January-2023,https://www.linkedin.com/feed/update/urn:li:activity:7022553445463195649,12,2
"This tweet made me chuckle 🙂I haven’t used the first two yet, but I definitely have explained it is “Product”, not “Project”, a few times 🧩#ProductManagement",https://media.licdn.com/dms/image/C5622AQHxMgbSWpbhRw/feedshare-shrink_800/0/1674220806443?e=1686787200&v=beta&t=4T9Xd4oABrFREqtaFWJjxh5ANDQvAGH7a8Hcu2CDCZ0,January-2023,https://www.linkedin.com/feed/update/urn:li:activity:7022191056377049088,11,2
"One of the best things I did to improve my hiring process was to reduce the phone interview duration by half 💡In order to generate remarkable results in my hiring approach, I've made some minor but impactful adjustments. 1️⃣ Firstly, I've significantly shortened phone interviews from a half hour to just 15 minutes. This saves the interviewer (me) and the candidate time and ensures that the conversation stays focused on the most critical information.2️⃣ Furthermore, before beginning any interviews, I've taken the time to identify a specific behavioural profile I'm looking for in a candidate based on the job description (e.g. Predictive Index)This helps me understand what qualities will be most valuable for the role and allows me to choose in advance a set of behavioural questions that will be most informative. This saves time and also helps to reduce bias.3️⃣ Another change I made was creating email templates for the most common messages I sent during the hiring process (e.g. Beeftext)This saves me a lot of time, increases efficiency and definitely improves my own overall experience.4️⃣ Lastly, I've automated the scheduling process of coffee chats, phone interviews, panel interviews, and reference checking (e.g. Calendly).This streamlines the hiring process, makes it much easier for everyone involved and allows me to focus on the most crucial part: evaluating the candidates themselves.👉 I've saved time, reduced bias, and improved the candidate experience by making these adjustments to my hiring process. If you want to improve yours, consider adopting similar strategies. 🧩#ManagementClick [+ Follow] for more",https://media.licdn.com/dms/image/C5622AQG5KeB10JOMAQ/feedshare-shrink_800/0/1674134405977?e=1686787200&v=beta&t=vXYGV8WxaIuxEN8eCsYKKUyMK7XkxJGEHDh-q05J5WY,January-2023,https://www.linkedin.com/feed/update/urn:li:activity:7021828679198543872,25,1
"Why not me?Yesterday I was fortunate enough to attend a session with Dave McKay, the CEO of the Royal Bank of Canada. One of the questions was about how he got to that prestigious position. He said he always had a voice inside asking, “Why not me?” He invited his RBC team to ask themselves the same question every time a new opportunity presents itself. Asking myself that question made me think about the self imposed barriers and limiting beliefs we create for ourselves. Insightful. 🧩Click [+ Follow] for more",,January-2023,https://www.linkedin.com/feed/update/urn:li:activity:7021468800789221376,36,0
"Tom Peters is a well-known management expert and author whose book In Search of Excellence has been a seminal text in business management for many years. He is known for his insightful, forthright, and contrarian approach to management. He has significantly influenced my career, shaping my perspectives on leadership and organizational excellence.I have had the privilege of attending two of his keynote presentations live at the World Economic Forum in Milan in 2004 and 2006.One of his latest messages is that every team should have a 𝗺𝘂𝘀𝗶𝗰 𝗼𝗿 𝘁𝗵𝗲𝗮𝘁𝗿𝗲 𝗺𝗮𝗷𝗼𝗿 aboard. I guess he reasons these individuals bring unique skills and perspectives to a team, such as creativity, problem-solving, and the ability to think on their feet. And that these skills are essential for any organization looking to stay ahead of the curve and innovate in a rapidly-changing world.Do you agree?🧩#ManagementClick [+ Follow] for more",https://media.licdn.com/dms/image/C5622AQEGvmkvvpbjkg/feedshare-shrink_800/0/1673961607141?e=1686787200&v=beta&t=OOWva8JDMBO0c5qNHaMc3IL318bvLECiRmKwLSXjzxc,January-2023,https://www.linkedin.com/feed/update/urn:li:activity:7021103900107685888,13,0
"I've interviewed tons of candidates in my time as a manager.Based on what I've seen, the best ones always have these five things in common 👇• They're seriously skilled but stay humble • They come prepared but aren't all scripted out • They're articulate but not stuck-up • They get to the point but also give all the details • They're confident but open to feedbackWhat about your top candidates? What qualities do they share?🧩#HiringClick [+ Follow] for more",https://media.licdn.com/dms/image/C5622AQHsoF2eFbvXFQ/feedshare-shrink_800/0/1673875204989?e=1686787200&v=beta&t=xk-oIk6F-Pxf27x15TiYJrrWYnjvO2Cl4yMxe7OlfZA,January-2023,https://www.linkedin.com/feed/update/urn:li:activity:7020741507200548865,22,5
"OpenAI's 𝗚𝗣𝗧-𝟯, or Generative Pre-trained Transformer 3, has caught the world's attention for its ability to produce text closely resembling human speech. Their next iteration in the GPT series, 𝗚𝗣𝗧-𝟰 boasts an impressive increase in size compared to its current version. Specifically, GPT-4 is estimated to have been trained with over 100 trillion parameters, which is significantly more than GPT-3's 175 billion parameters. 🤯 These numbers take time to comprehend. If we convert them into time units:• 175 billion seconds is about 5,500 years. That's about the number years elapsed from the construction of the Pyramids to today • 100 trillion seconds is 3,170,979 years or about 𝟲𝟯𝟬 𝘁𝗶𝗺𝗲𝘀 the years elapsed from the construction of the Pyramids As a result, it will be even better at language production and translation tasks by processing and retaining more information and nuances in language. Unlike GPT-3, GPT-4 is not publicly available at the moment and is only accessible to a select group of academics and developers.🧩#AIClick [+ Follow] for more",https://media.licdn.com/dms/image/C5622AQGbRHSTDODt-w/feedshare-shrink_800/0/1673788806764?e=1686787200&v=beta&t=El4gt9w0iCam0GSRhTKp6E1Mw2_kymIjvk_QaoI6RuQ,January-2023,https://www.linkedin.com/feed/update/urn:li:activity:7020379140021264384,18,0
"Hey LinkedIn, how many of you peuvent lire ça?🧩#FunnyClick [+ Follow] for more",https://media.licdn.com/dms/image/C5622AQFFoXMBjVJIIA/feedshare-shrink_800/0/1673702402381?e=1686787200&v=beta&t=Lvpju3INdVwA9HJP809UinTzuzIxgqcj9duVoLlGZQ8,January-2023,https://www.linkedin.com/feed/update/urn:li:activity:7020016705414320128,31,11
"Correction: In a previous version of this post, I incorrectly stated that the terms 'bull' and 'bear' in relation to the stock market originated from the movements of the animals themselves (i.e. bulls attack by swiping up, bears by swiping down). This is not the case. The terms originated from a proverb warning against selling the bear's skin before you have caught it. The term 'bear' was first used in the 18th century to refer to speculators selling stock they didn't own, expecting prices to drop. This practice was prevalent in the South Sea bubble scandal of 1720, which brought the term into widespread use. The term 'bull' was later coined to refer to those who bought securities or commodities expecting a price rise. The more you know.🧩#MarketsClick [+ Follow] for more",https://media.licdn.com/dms/image/C5622AQE465C3eQHBEg/feedshare-shrink_800/0/1673616005488?e=1686787200&v=beta&t=JOXYRVn5mvszgRlUI2rNgR_hjYoX_LAYnaN3RQYu6So,January-2023,https://www.linkedin.com/feed/update/urn:li:activity:7019654334992846848,18,3
