is_scrapped,content_of_the_post,content_media,date,post_url,number_of_likes,number_of_comments,rewrited_content,professional_and_friendle,conversational_and_clear,clear and concise,Unnamed: 11
True,"As someone who likes Lean, systems, playbooks - and efficiency - this stopped me in my tracks.Did I completely miss the point? 𝘐𝘧 𝘸𝘦 𝘸𝘢𝘯𝘵 𝘴𝘰𝘮𝘦𝘵𝘩𝘪𝘯𝘨 𝘵𝘰 𝘦𝘯𝘥𝘶𝘳𝘦, 𝘸𝘦 𝘴𝘵𝘳𝘪𝘷𝘦 𝘧𝘰𝘳 𝘣𝘦𝘢𝘶𝘵𝘺, 𝘯𝘰𝘵 𝘧𝘰𝘳 𝘦𝘧𝘧𝘪𝘤𝘪𝘦𝘯𝘤𝘺.I suspect this applies beyond architecture and urban planning. It's an invitation to reflect on how I can introduce Beauty to my work. And in the other aspects of Life.🧩",https://media.licdn.com/dms/image/C5622AQEEPkEQAldd6w/feedshare-shrink_800/0/1668777304946?e=1686787200&v=beta&t=PKi5KQFw598NmuIPTGsR2GnXkd0MaCmqYziifaAofG8,Nov-22,https://www.linkedin.com/feed/update/urn:li:activity:6999359358149033984,13,3,"{'Professional and Friendly Tone': ""\nHi there. \n\nSo, I've got a thing for Lean principles, system setups, even playbooks. \n\nEfficiency? It's kind of my jam. \n\nBut then, something made me stop and think. \n\nDid I perhaps misunderstand the main idea? \n\nHere's a bold thought: **If we desire something to last, we should aim for beauty, not just efficiency.** \n\nI have a hunch this concept reaches beyond just architecture and city planning. \n\nIt's an invite for me to ponder - How can I bring a touch of beauty into my work? \n\nAnd also into other parts of life. \n\nThanks for joining me in this exploration. \n\n🧩\n\n"", 'Conversational and Clear Tone': ""\nHey! \n\nSo, I'm into this stuff called Lean, systems, playbooks - you know, making things work smooth and easy. 😎 \n\nBut then - boom - something made me stop and think. 🤔\n\nDid I miss the whole point? \n\nCheck this out: **If we want something to last, we should go for beauty, not just get it done fast.** \n\nI think this idea doesn't stop at designing buildings or planning cities. 🏙️\n\nIt's kinda like a challenge for me to think about - How can I make my work not just fast, but also cool and beautiful? \n\nAnd not just in work, but in life too. 🌈\n\nKeep rockin'! \n\n🧩\n\n"", 'Clear and Concise Tone': '\nGreetings, \n\nI have a penchant for Lean methodology, systematized operations, and playbooks. \n\nEfficiency is a key goal. \n\nHowever, a recent revelation made me pause. \n\nHave I misunderstood the foundational premise? \n\nConsider this: **To create something durable, beauty should be the objective, not merely efficiency.** \n\nI hypothesize that this principle extends beyond architecture and urban planning. \n\nIt prompts introspection on how I can incorporate aesthetic appeal into my professional endeavors. \n\nAs well as in other facets of existence. \n\nTo continued growth and success. \n\n🧩\n\n'}","
Hi there. 

So, I've got a thing for Lean principles, system setups, even playbooks. 

Efficiency? It's kind of my jam. 

But then, something made me stop and think. 

Did I perhaps misunderstand the main idea? 

Here's a bold thought: **If we desire something to last, we should aim for beauty, not just efficiency.** 

I have a hunch this concept reaches beyond just architecture and city planning. 

It's an invite for me to ponder - How can I bring a touch of beauty into my work? 

And also into other parts of life. 

Thanks for joining me in this exploration. 

🧩

","
Hey! 

So, I'm into this stuff called Lean, systems, playbooks - you know, making things work smooth and easy. 😎 

But then - boom - something made me stop and think. 🤔

Did I miss the whole point? 

Check this out: **If we want something to last, we should go for beauty, not just get it done fast.** 

I think this idea doesn't stop at designing buildings or planning cities. 🏙️

It's kinda like a challenge for me to think about - How can I make my work not just fast, but also cool and beautiful? 

And not just in work, but in life too. 🌈

Keep rockin'! 

🧩

","
Greetings, 

I have a penchant for Lean methodology, systematized operations, and playbooks. 

Efficiency is a key goal. 

However, a recent revelation made me pause. 

Have I misunderstood the foundational premise? 

Consider this: **To create something durable, beauty should be the objective, not merely efficiency.** 

I hypothesize that this principle extends beyond architecture and urban planning. 

It prompts introspection on how I can incorporate aesthetic appeal into my professional endeavors. 

As well as in other facets of existence. 

To continued growth and success. 

🧩

",
True,"So simple, yet so effective! Anyone could do the same to locate their organization's best teams/leaders.In what other scenario would it be clever to use this approach?🧩",https://media.licdn.com/dms/image/C5622AQGIvOBJHrfSgg/feedshare-shrink_800/0/1668734108261?e=1686787200&v=beta&t=LlPfQhUmINjrKQggcG6oSjmyo-H9JIC_ZXkLrVwRefc,Nov-22,https://www.linkedin.com/feed/update/urn:li:activity:6999178179051499521,2,0,"{'Professional and Friendly Tone': '\n**I discovered a straightforward technique** that works like a charm! \n\nBelieve it or not, this method can help anyone identify the **top performers** in their organization. \n\nHave you ever wondered where else this strategy might be handy?🧩\n\n', 'Conversational and Clear Tone': ""\nHey there! 🙋\u200d♂️ \n\nGuess what? **I found a really easy way** that's super effective! 🚀 \n\nCool, right? 😎 It could help anyone find who's really awesome in their group or club. \n\nEver thought about where else this trick could work wonders? 🤔 🧩\n\n"", 'Clear and Concise Tone': ""\nEntrepreneurs, listen up. \n\n**I've uncovered a simple, yet potent strategy.** \n\nThis can be utilized to spot your organization's **star teams or leaders.** \n\nEver contemplated the other potential applications of this approach? 🧩\n\n""}","
**I discovered a straightforward technique** that works like a charm! 

Believe it or not, this method can help anyone identify the **top performers** in their organization. 

Have you ever wondered where else this strategy might be handy?🧩

","
Hey there! 🙋‍♂️ 

Guess what? **I found a really easy way** that's super effective! 🚀 

Cool, right? 😎 It could help anyone find who's really awesome in their group or club. 

Ever thought about where else this trick could work wonders? 🤔 🧩

","
Entrepreneurs, listen up. 

**I've uncovered a simple, yet potent strategy.** 

This can be utilized to spot your organization's **star teams or leaders.** 

Ever contemplated the other potential applications of this approach? 🧩

",
True,"Have you heard we live in a VUCA world?It means that Volatility, Uncertainty, Complexity and Ambiguity make it challenging to understand the present and predict the future.Change Management, therefore, is the arena where companies, departments and individuals battle the VUCA world. The Knoster model (below) is a framework for Change Management that shows how each “ingredient” contributes to the “recipe.”🧩",https://media.licdn.com/dms/image/C5622AQGrCEsrYye3JQ/feedshare-shrink_800/0/1668690907164?e=1686787200&v=beta&t=L3cXdlj2sDkOYrAgspAfPX9qty6-XB9OZlyVYfKAuus,Nov-22,https://www.linkedin.com/feed/update/urn:li:activity:6998997017985245184,19,6,"{'Professional and Friendly Tone': '\nHello there!\n\nI wanted to share something interesting with you. Did you know we\'re living in a 𝗩𝗨𝗖𝗔 world? \n\nIt stands for 𝗩olatility, 𝗨ncertainty, 𝗖omplexity and 𝗔mbiguity. These four elements make it hard for us to grasp what\'s happening now and predict what might happen next.\n\nBecause of this, Change Management has become a vital part of how companies, departments and individuals navigate this VUCA world.\n\nOne framework that\'s really helped me understand this better is the Knoster model. Each ""ingredient"" of the model contributes to the ""recipe"" for managing change.\n\nIt\'s a fascinating concept, don\'t you think?🧩\n\n', 'Conversational and Clear Tone': ""\nHey guys! 😊\n\nGuess what? We live in a crazy 𝗩𝗨𝗖𝗔 world! 🌍 \n\nThat's short for 𝗩olatility, 𝗨ncertainty, 𝗖omplexity and 𝗔mbiguity. These words might seem big, but they simply mean things change fast, it's hard to be sure about stuff, things can get pretty complicated, and it's often unclear what's going on. 🤔\n\nSo, how do we handle this? That's where Change Management comes in. It's like a game plan for businesses, teams, and even us, to tackle this VUCA world.\n\nI've been learning about this thing called the Knoster model. It's like a recipe, and each part of it helps us understand how to manage change better. \n\nPretty cool, huh? 🧩\n\n"", 'Clear and Concise Tone': '\nGood day, Entrepreneurs,\n\nI\'d like to bring your attention to the concept of a 𝗩𝗨𝗖𝗔 world. \n\nThis acronym stands for 𝗩olatility, 𝗨ncertainty, 𝗖omplexity, and 𝗔mbiguity, factors that can hinder our understanding of the present and future.\n\nConsequently, Change Management is essential. As entrepreneurs, it is in this area we face and conquer the VUCA challenges.\n\nI\'ve found the Knoster model incredibly insightful. It breaks down Change Management into components, each an ""ingredient"" contributing to the overall ""recipe.""\n\nValuable perspective, isn\'t it? 🧩\n'}","
Hello there!

I wanted to share something interesting with you. Did you know we're living in a 𝗩𝗨𝗖𝗔 world? 

It stands for 𝗩olatility, 𝗨ncertainty, 𝗖omplexity and 𝗔mbiguity. These four elements make it hard for us to grasp what's happening now and predict what might happen next.

Because of this, Change Management has become a vital part of how companies, departments and individuals navigate this VUCA world.

One framework that's really helped me understand this better is the Knoster model. Each ""ingredient"" of the model contributes to the ""recipe"" for managing change.

It's a fascinating concept, don't you think?🧩

","
Hey guys! 😊

Guess what? We live in a crazy 𝗩𝗨𝗖𝗔 world! 🌍 

That's short for 𝗩olatility, 𝗨ncertainty, 𝗖omplexity and 𝗔mbiguity. These words might seem big, but they simply mean things change fast, it's hard to be sure about stuff, things can get pretty complicated, and it's often unclear what's going on. 🤔

So, how do we handle this? That's where Change Management comes in. It's like a game plan for businesses, teams, and even us, to tackle this VUCA world.

I've been learning about this thing called the Knoster model. It's like a recipe, and each part of it helps us understand how to manage change better. 

Pretty cool, huh? 🧩

","
Good day, Entrepreneurs,

I'd like to bring your attention to the concept of a 𝗩𝗨𝗖𝗔 world. 

This acronym stands for 𝗩olatility, 𝗨ncertainty, 𝗖omplexity, and 𝗔mbiguity, factors that can hinder our understanding of the present and future.

Consequently, Change Management is essential. As entrepreneurs, it is in this area we face and conquer the VUCA challenges.

I've found the Knoster model incredibly insightful. It breaks down Change Management into components, each an ""ingredient"" contributing to the overall ""recipe.""

Valuable perspective, isn't it? 🧩
",
