is_scrapped,content_of_the_post,content_media,date,post_url,number_of_likes,number_of_comments,rewrited_content,professional_and_friendle,conversational_and_clear,clear and concise,Unnamed: 11
True,Happy Thanksgiving long weekend to my friends south of the border. Enjoy your holiday!🧩,,Nov-22,https://www.linkedin.com/feed/update/urn:li:activity:7001694239411642368,3,0,"{'Professional and Friendly Tone': ""\nHello there,\n\n**I'm thrilled** to send my warmest wishes your way. \n\nIt's Thanksgiving weekend for all my friends in the southern regions. \n\n**Have a wonderful** holiday.\n\nRemember to cherish the good times!\n\n🧩\n\n"", 'Conversational and Clear Tone': ""\nHey folks, 🙌\n\nGuess what? \n\n**It's Thanksgiving weekend** for all my buddies down south. \n\n**Get set to enjoy** your holiday. 🦃🍁\n\nMake the most of it! 🎉\n\n🧩\n\n"", 'Clear and Concise Tone': ""\nDear colleagues,\n\n**I'm recognizing** the Thanksgiving weekend here. \n\nMy friends based southward, it's your time to unwind.\n\n**Celebrate your** holiday.\n\nTake this opportunity to relax and rejuvenate.\n\n🧩\n""}","
Hello there,

**I'm thrilled** to send my warmest wishes your way. 

It's Thanksgiving weekend for all my friends in the southern regions. 

**Have a wonderful** holiday.

Remember to cherish the good times!

🧩

","
Hey folks, 🙌

Guess what? 

**It's Thanksgiving weekend** for all my buddies down south. 

**Get set to enjoy** your holiday. 🦃🍁

Make the most of it! 🎉

🧩

","
Dear colleagues,

**I'm recognizing** the Thanksgiving weekend here. 

My friends based southward, it's your time to unwind.

**Celebrate your** holiday.

Take this opportunity to relax and rejuvenate.

🧩
",
True,"Last week the world population reached 8 Billion people! Growing up, I heard about the dangers of endless overpopulation.Instead, we'll peak at about 10.4 billion in 2086 before falling again.Here's how quickly the population grew:• It was in 1805 that the world reached its first billion; it then took another 120 years to reach two billion. • By the third billion, this period had reduced to 35 years, reduced further to 14 years to reach four billion. • The fastest growth occurred from 1974 to 2011, taking only 12 to 13 years to increase by one billion for the 5th, 6th, and 7th.• The world has now surpassed the peak growth rate, and the period between each billion will continue to rise. • It's estimated to take approximately 14 years to reach nine billion in 2037 and a further 21 years to reach 10 billion in 2058. 🧩",https://media.licdn.com/dms/image/C5622AQFrs7U2BpKa6g/feedshare-shrink_800/0/1669256706108?e=1686787200&v=beta&t=2tcOFGdfZBjz5vAYl34mddHI0JyCBFKQqtAa_NUPO3g,Nov-22,https://www.linkedin.com/feed/update/urn:li:activity:7001370083260334080,9,2,"{'Professional and Friendly Tone': ""\n**I want to share something astounding with you!** \n\nJust last week, we reached a global population of 8 billion people. \n\nWhen I was growing up, many talked about the frightening concept of endless population growth. \n\nBut interestingly, projections show we're not headed towards an infinite increase. \n\nThe predictions say we will likely peak around 10.4 billion people in the year 2086, and after that, we'll see a decline. \n\nI want you to understand how fast our global family has grown: \n\nIn 1805, we first hit a billion folks around the globe. \n\nIt took us another lengthy period of 120 years to double that number. \n\nBut as time passed, the pace picked up. The jump from two to three billion? It took just 35 years. \n\nGetting from three to four billion was even quicker, requiring only 14 years. \n\nThe rapid expansion was most pronounced between 1974 and 2011. \n\nDuring this time, every increase of one billion people took merely 12 to 13 years for the 5th, 6th, and 7th billion. \n\nHowever, it's worth noting we've now crossed the period of peak growth. \n\nGoing forward, the time between each billion added will increase. \n\nEstimates suggest it'll take roughly 14 years to reach nine billion by 2037. \n\nAnd a significant 21 years are needed to reach the 10 billion mark by 2058. 🧩\n\n"", 'Conversational and Clear Tone': ""\nHey everyone, guess what? 📢\n\nWe hit **8 billion people on Earth** just last week! 🌍\n\nWhen I was a kid, I used to hear scary stories about the world being overcrowded forever. 😱\n\nBut guess what? It looks like we'll max out at around 10.4 billion in 2086 and then start going down. 📉\n\nSo here's the scoop on how fast we've grown: 📊\n\nBack in 1805, we finally reached one billion people. \n\nBut then it took another long, looong 120 years to hit two billion. ⏳\n\nWhen we went for the third billion, it only took 35 years. And it only took 14 years to get to four billion. 🚀\n\nFrom 1974 to 2011, it was like a race. Each billion for the 5th, 6th, and 7th only took 12 to 13 years each. 🏁\n\nBut cool your jets, because we're now past the fastest growth. \n\nEach billion we add from now on will take longer and longer. ⌛\n\nThey're saying we'll hit nine billion by 2037 (that's 14 years away) and ten billion by 2058 (21 years after that). 🗓️\n\nCatch ya later! 🧩\n\n"", 'Clear and Concise Tone': ""\nTake note, fellow entrepreneurs! \n\n**We have reached 8 billion people in the global population last week.** \n\nDuring my formative years, I was informed about the looming issue of overpopulation. \n\nBut according to current data, we're expecting to peak at about 10.4 billion in 2086 and then descend. \n\nHere's a snapshot of how the population has grown: \n\nIt was 1805 when we first hit one billion, then another 120 years to reach two billion. \n\nThis interval dropped to 35 years to achieve three billion, and further to 14 years to arrive at four billion. \n\nThe fastest acceleration happened between 1974 to 2011, where it took just 12 to 13 years for each increase of a billion for the\n""}","
**I want to share something astounding with you!** 

Just last week, we reached a global population of 8 billion people. 

When I was growing up, many talked about the frightening concept of endless population growth. 

But interestingly, projections show we're not headed towards an infinite increase. 

The predictions say we will likely peak around 10.4 billion people in the year 2086, and after that, we'll see a decline. 

I want you to understand how fast our global family has grown: 

In 1805, we first hit a billion folks around the globe. 

It took us another lengthy period of 120 years to double that number. 

But as time passed, the pace picked up. The jump from two to three billion? It took just 35 years. 

Getting from three to four billion was even quicker, requiring only 14 years. 

The rapid expansion was most pronounced between 1974 and 2011. 

During this time, every increase of one billion people took merely 12 to 13 years for the 5th, 6th, and 7th billion. 

However, it's worth noting we've now crossed the period of peak growth. 

Going forward, the time between each billion added will increase. 

Estimates suggest it'll take roughly 14 years to reach nine billion by 2037. 

And a significant 21 years are needed to reach the 10 billion mark by 2058. 🧩

","
Hey everyone, guess what? 📢

We hit **8 billion people on Earth** just last week! 🌍

When I was a kid, I used to hear scary stories about the world being overcrowded forever. 😱

But guess what? It looks like we'll max out at around 10.4 billion in 2086 and then start going down. 📉

So here's the scoop on how fast we've grown: 📊

Back in 1805, we finally reached one billion people. 

But then it took another long, looong 120 years to hit two billion. ⏳

When we went for the third billion, it only took 35 years. And it only took 14 years to get to four billion. 🚀

From 1974 to 2011, it was like a race. Each billion for the 5th, 6th, and 7th only took 12 to 13 years each. 🏁

But cool your jets, because we're now past the fastest growth. 

Each billion we add from now on will take longer and longer. ⌛

They're saying we'll hit nine billion by 2037 (that's 14 years away) and ten billion by 2058 (21 years after that). 🗓️

Catch ya later! 🧩

","
Take note, fellow entrepreneurs! 

**We have reached 8 billion people in the global population last week.** 

During my formative years, I was informed about the looming issue of overpopulation. 

But according to current data, we're expecting to peak at about 10.4 billion in 2086 and then descend. 

Here's a snapshot of how the population has grown: 

It was 1805 when we first hit one billion, then another 120 years to reach two billion. 

This interval dropped to 35 years to achieve three billion, and further to 14 years to arrive at four billion. 

The fastest acceleration happened between 1974 to 2011, where it took just 12 to 13 years for each increase of a billion for the
",
True,"𝗗𝗼𝗻'𝘁 𝘀𝗵𝗼𝗼𝘁 𝘁𝗵𝗲 𝗺𝗲𝘀𝘀𝗲𝗻𝗴𝗲𝗿!I used to think this was a warning about fairness, about not making the messenger pay for someone else's misconduct.I learned today it's about self-preservation instead 🤯While the phrase originates in the fog of history, one of its earlier documented use is by Plutarch when he writes about Tigranes, King of Armenia.When a messenger gave notice of a political enemy coming to see him, Tigranes had the messenger's head cut off. After that incident, no one dared bring any further negative information. Tigranes, while at war, had no enemy intelligence, ultimately resulting in several military defeats.👉 My takeaway, in a business setting: listen to dissenting views instead of silencing or ignoring them.🧩",,Nov-22,https://www.linkedin.com/feed/update/urn:li:activity:7001003469289529344,8,2,"{'Professional and Friendly Tone': ""\n**Please remember, it's never right to get upset with the one who brings news!** In the past, I used to think that this phrase was all about being fair and not blaming the person delivering the message for any bad news. But just recently, I learned something new! It's actually more about protecting yourself. Isn't that fascinating? \n\n**The saying is actually very old**, and one of the earliest times it's written down is by a guy named Plutarch who was telling a story about a king called Tigranes from a place called Armenia. Here's what happened: Tigranes got a message from a guy warning him that an enemy was coming to visit. Tigranes got so mad that he chopped off the messenger's head! Can you believe that?\n\n**Because of this, no one wanted to give him any bad news** anymore, even when he was in the middle of a war! And because of that, Tigranes ended up losing many battles. \n\nSo here's what I think we can all learn from this story, especially in work situations: **always pay attention to different opinions, even if you don't agree with them right away**. It's a smart way to protect ourselves and our businesses. \n\n🧩\n\n"", 'Conversational and Clear Tone': '\nSo, you know that old saying, **""Don\'t shoot the messenger!""**? 😊 I used to think it meant just not blaming the guy delivering bad news. But guess what? I just found out it\'s about a whole lot more - it\'s about looking out for yourself! 😲\n\nDid you know the phrase has a super old backstory? 🧐 It\'s all about this king called Tigranes from Armenia. When a messenger warned him about a political enemy coming over, Tigranes was like, ""Off with his head!"" 😱 **No one wanted to be the bearer of bad news after that**, and you know what happened? Tigranes didn\'t know about the stuff going on in the war he was fighting, leading to his defeat in many battles! 😓\n\nSo, here\'s my piece of advice for all you guys: **Don\'t ignore or silence different ideas or news that seem bad** at first, especially when it comes to your job or school stuff. Remember, the more you know, the better you can handle anything that comes your way! 😉 \n\n🧩\n\n', 'Clear and Concise Tone': '\nConsider the old adage, **""Don\'t shoot the messenger.""** Originally, I interpreted this as a cautionary tale against unjust blame. However, I have since discovered it is fundamentally about self-preservation.\n\nThis phrase has **ancient origins**, one of which can be traced back to Plutarch\'s accounts of Tigranes, the King of Armenia. Tigranes executed a messenger who brought him news of a political adversary. This led to a chilling effect; no one wanted to deliver unfavorable information.\n\nThe result was dire: **Tigranes found himself ill-prepared in times of war**, facing multiple defeats due to lack of intelligence. \n\nFrom this, I infer a critical lesson for entrepreneurs: **Embrace dissenting views rather than disregarding or suppressing them**. This is crucial for informed decision-making and eventual success in your ventures. \n\n🧩\n\n'}","
**Please remember, it's never right to get upset with the one who brings news!** In the past, I used to think that this phrase was all about being fair and not blaming the person delivering the message for any bad news. But just recently, I learned something new! It's actually more about protecting yourself. Isn't that fascinating? 

**The saying is actually very old**, and one of the earliest times it's written down is by a guy named Plutarch who was telling a story about a king called Tigranes from a place called Armenia. Here's what happened: Tigranes got a message from a guy warning him that an enemy was coming to visit. Tigranes got so mad that he chopped off the messenger's head! Can you believe that?

**Because of this, no one wanted to give him any bad news** anymore, even when he was in the middle of a war! And because of that, Tigranes ended up losing many battles. 

So here's what I think we can all learn from this story, especially in work situations: **always pay attention to different opinions, even if you don't agree with them right away**. It's a smart way to protect ourselves and our businesses. 

🧩

","
So, you know that old saying, **""Don't shoot the messenger!""**? 😊 I used to think it meant just not blaming the guy delivering bad news. But guess what? I just found out it's about a whole lot more - it's about looking out for yourself! 😲

Did you know the phrase has a super old backstory? 🧐 It's all about this king called Tigranes from Armenia. When a messenger warned him about a political enemy coming over, Tigranes was like, ""Off with his head!"" 😱 **No one wanted to be the bearer of bad news after that**, and you know what happened? Tigranes didn't know about the stuff going on in the war he was fighting, leading to his defeat in many battles! 😓

So, here's my piece of advice for all you guys: **Don't ignore or silence different ideas or news that seem bad** at first, especially when it comes to your job or school stuff. Remember, the more you know, the better you can handle anything that comes your way! 😉 

🧩

","
Consider the old adage, **""Don't shoot the messenger.""** Originally, I interpreted this as a cautionary tale against unjust blame. However, I have since discovered it is fundamentally about self-preservation.

This phrase has **ancient origins**, one of which can be traced back to Plutarch's accounts of Tigranes, the King of Armenia. Tigranes executed a messenger who brought him news of a political adversary. This led to a chilling effect; no one wanted to deliver unfavorable information.

The result was dire: **Tigranes found himself ill-prepared in times of war**, facing multiple defeats due to lack of intelligence. 

From this, I infer a critical lesson for entrepreneurs: **Embrace dissenting views rather than disregarding or suppressing them**. This is crucial for informed decision-making and eventual success in your ventures. 

🧩

",
True,"I'm reading a book about decision-making in Business and Life. The author is using Chess and Poker as two possible models.I'm curious, what does LinkedIn think?🧩",,Nov-22,https://www.linkedin.com/feed/update/urn:li:activity:7000625816707510272,5,10,"{'Professional and Friendly Tone': ""\nHello everyone! I've been immersing myself in an engaging book recently. The core of this book revolves around the concepts of decision-making in the realms of both Business and Life.\n\nInterestingly, the author introduces the strategies of two well-loved games, Chess and Poker, to illustrate their theories. They believe these games provide useful models for decision-making.\n\nI find myself increasingly intrigued by this concept. Now, I'm interested in the collective wisdom of our LinkedIn community. What are your thoughts on this matter? 🧩\n\n"", 'Conversational and Clear Tone': ""\nHey guys! 😊 Guess what? I'm totally absorbed in this cool book right now. It's all about how to make choices, not just in biz stuff, but also in real life. 👍\n\nYou know what's interesting? The writer uses games to explain it all! Ever heard of Chess and Poker? Yep, those are the games. 🎲🃏 They think we can learn from them and become decision-making pros! \n\nIt's got me thinking a lot... 💭 So, what do you guys on LinkedIn think? Any ideas? Let's chat! 🧩\n\n"", 'Clear and Concise Tone': ""\nCurrently, I'm reading a strategic book about decision-making in business and life.\n\nThe author leverages the strategies of Chess and Poker as models.\n\nIntriguing, isn't it? \n\nI'm keen on understanding LinkedIn's perspective on this. 🧩\n\n""}","
Hello everyone! I've been immersing myself in an engaging book recently. The core of this book revolves around the concepts of decision-making in the realms of both Business and Life.

Interestingly, the author introduces the strategies of two well-loved games, Chess and Poker, to illustrate their theories. They believe these games provide useful models for decision-making.

I find myself increasingly intrigued by this concept. Now, I'm interested in the collective wisdom of our LinkedIn community. What are your thoughts on this matter? 🧩

","
Hey guys! 😊 Guess what? I'm totally absorbed in this cool book right now. It's all about how to make choices, not just in biz stuff, but also in real life. 👍

You know what's interesting? The writer uses games to explain it all! Ever heard of Chess and Poker? Yep, those are the games. 🎲🃏 They think we can learn from them and become decision-making pros! 

It's got me thinking a lot... 💭 So, what do you guys on LinkedIn think? Any ideas? Let's chat! 🧩

","
Currently, I'm reading a strategic book about decision-making in business and life.

The author leverages the strategies of Chess and Poker as models.

Intriguing, isn't it? 

I'm keen on understanding LinkedIn's perspective on this. 🧩

",
True,Who neither knows victory nor defeat 🧩,https://media.licdn.com/dms/image/C5622AQESq04CBl471Q/feedshare-shrink_800/0/1668952857123?e=1686787200&v=beta&t=AS8Or6QY7Xsrlka0r8c_agUngz67ttdVFjY4VXJ08A8,Nov-22,https://www.linkedin.com/feed/update/urn:li:activity:7000095650742767616,13,0,"{'Professional and Friendly Tone': ""\nI believe it's true to say that **I** haven't tasted the thrill of **victory**.\n\nNor have **I** encountered the gloom of **defeat**. \n\nBy sharing this, I hope you can learn from my experiences. \n\n🧩\n\n"", 'Conversational and Clear Tone': ""\nHey there! 👋\n\nJust thought you should know, **I** haven't ever won a big one. 🏆\n\nNeither have **I** lost badly. 😓\n\nIt's kind of unique, isn't it? 🤔 \n\nSigning off, 🧩\n\n"", 'Clear and Concise Tone': ""\nIn business terms, **I** have yet to experience a triumphant **victory**.\n\nAnd interestingly, **I** haven't suffered a crushing **defeat**.\n\nThis can serve as a noteworthy lesson for entrepreneurs. \n\n🧩\n""}","
I believe it's true to say that **I** haven't tasted the thrill of **victory**.

Nor have **I** encountered the gloom of **defeat**. 

By sharing this, I hope you can learn from my experiences. 

🧩

","
Hey there! 👋

Just thought you should know, **I** haven't ever won a big one. 🏆

Neither have **I** lost badly. 😓

It's kind of unique, isn't it? 🤔 

Signing off, 🧩

","
In business terms, **I** have yet to experience a triumphant **victory**.

And interestingly, **I** haven't suffered a crushing **defeat**.

This can serve as a noteworthy lesson for entrepreneurs. 

🧩
",
True,"As a European, I can confirm it checks out 💯🧩",https://media.licdn.com/dms/image/C5622AQH17XP_xYu7_A/feedshare-shrink_800/0/1668900778657?e=1686787200&v=beta&t=8FuGkpnWsySgFmh9Y-7-Dncr5oXZDEvWhluFM4GFXg4,Nov-22,https://www.linkedin.com/feed/update/urn:li:activity:6999877214125125633,6,3,"{'Professional and Friendly Tone': '\nAs someone hailing from Europe, **I can confidently validate** this. 🧩\n\n', 'Conversational and Clear Tone': ""\nGuess what, guys? Since I'm from Europe, **I can totally give it a thumbs up**. It's 💯 right! 🧩\n\n"", 'Clear and Concise Tone': '\nBeing a European myself, **I can vouch for its accuracy**. 🧩\n\n'}","
As someone hailing from Europe, **I can confidently validate** this. 🧩

","
Guess what, guys? Since I'm from Europe, **I can totally give it a thumbs up**. It's 💯 right! 🧩

","
Being a European myself, **I can vouch for its accuracy**. 🧩

",
True,Requirements elicitation for software development is indeed both an Art and a Science 😜,https://media.licdn.com/dms/image/C5622AQGIa8N3B7Z6dg/feedshare-shrink_800/0/1668868506481?e=1686787200&v=beta&t=zJHb-MVpS2aKjQtkdTV6nVrGZrVe54hPMIX-gWmzis0,Nov-22,https://www.linkedin.com/feed/update/urn:li:activity:6999741855642910720,8,1,"{'Professional and Friendly Tone': ""\n1. Hi there!\n\n2. In my line of work, I've seen that figuring out what we need for creating software is a real combination of Art and Science.\n\n3. It's not just about being good with computers.\n\n4. You also need a dash of creativity, like an artist! \n\n5. 🧩\n\n"", 'Conversational and Clear Tone': ""\n1. Hey, did you know?\n\n2. In my world, creating software is like a cool mix of Art and Science! 🖥️🎨 \n\n3. We don't just geek out on codes. \n\n4. We also let our imagination run wild! 🚀 \n\n5. Isn't that wickedly awesome? 😜\n\n6. 🧩\n\n"", 'Clear and Concise Tone': ""\n1. Entrepreneurs, listen up!\n\n2. From my own journey, identifying what we require for software development, is both an Art and a Science.\n\n3. It's not just about technical expertise.\n\n4. We also need to incorporate innovation and creativity.\n\n5. This is the essence of our work.\n\n6. 🧩\n""}","
1. Hi there!

2. In my line of work, I've seen that figuring out what we need for creating software is a real combination of Art and Science.

3. It's not just about being good with computers.

4. You also need a dash of creativity, like an artist! 

5. 🧩

","
1. Hey, did you know?

2. In my world, creating software is like a cool mix of Art and Science! 🖥️🎨 

3. We don't just geek out on codes. 

4. We also let our imagination run wild! 🚀 

5. Isn't that wickedly awesome? 😜

6. 🧩

","
1. Entrepreneurs, listen up!

2. From my own journey, identifying what we require for software development, is both an Art and a Science.

3. It's not just about technical expertise.

4. We also need to incorporate innovation and creativity.

5. This is the essence of our work.

6. 🧩
",
True,Would you attend? Why or why not? 👇,https://media.licdn.com/dms/image/C5622AQG1hkfg7oK_FQ/feedshare-shrink_800/0/1668819220400?e=1686787200&v=beta&t=_Su2fnFMeMphf4rRhp6iWziFlKkeQVyYX_9YQfqt45Y,Nov-22,https://www.linkedin.com/feed/update/urn:li:activity:6999535134328700929,12,4,"{'Professional and Friendly Tone': ""\nI'm curious to know:\n\nWould **I consider joining**?\n\nAnd more importantly, **what would be my reasons** if I chose to do so, or if I decided otherwise?\n\n🧩\n\n"", 'Conversational and Clear Tone': ""\nHey there! 😃\n\nI was just wondering,\n\n**Would I go**?\n\nAnd you know, I'm also thinking **what might be the reasons** if I said 'yes' or if I was like 'nah, not for me'?\n\n🧩\n\n"", 'Clear and Concise Tone': '\nFrom an entrepreneurial perspective,\n\nThe question arises,\n\n**Would I participate**?\n\nNotably, **what would drive my decision**, whether affirmative or negative?\n\n🧩\n\n'}","
I'm curious to know:

Would **I consider joining**?

And more importantly, **what would be my reasons** if I chose to do so, or if I decided otherwise?

🧩

","
Hey there! 😃

I was just wondering,

**Would I go**?

And you know, I'm also thinking **what might be the reasons** if I said 'yes' or if I was like 'nah, not for me'?

🧩

","
From an entrepreneurial perspective,

The question arises,

**Would I participate**?

Notably, **what would drive my decision**, whether affirmative or negative?

🧩

",
